Titel	Werktitel	Verfasser	Verlag	Verlagsort	Erscheinungsjahr	Erscheinungstermin	ISBN	Auflage	Preis	Seiten	Maß	Begleitmaterial	Reihe	Fußnote	Parallele Ausgabe	Hochschulschriftenvermerk	Datenträger	Wochenverzeichnisnummer	DDC-Sachgruppe	Schlagworte	Vollständige DDC-Notation	Inhaltsverzeichnis	Inhaltstext	Links	Desiderat
Landeshochschulgesetz Baden-Württemberg : Kommentar zum Gesetz über die Hochschulen in Baden-Württemberg (Landeshochschulgesetz - LHG), zum Universitätsklinik-Gesetz (UKG) und zum Gesetz über das Karlsruher Institut für Technologie (KIT-Gesetz)	-	von Professor Dr. jur. Dr. jur. h.c. Georg Sandberger (Kanzler der Universität Tübingen a.D., Honorarprofessor an der Juristischen Fakultät der Universität Tübingen)	C.F. Müller	Heidelberg	2022	-	9783811487017; 3811487019	3., neu bearbeitete Auflage	(Festeinband : circa EUR 140.00 (DE), circa EUR 144.00 (AT))	XXXIV, 931 Seiten	22 cm, 1288 g	-	Heidelberger Kommentar	-	Erscheint auch als: Online-Ausgabe	-	Band	22,A13; 21,N07	340	Baden-Württemberg; Hochschulrecht	344.4346074	https://d-nb.info/1226875122/04	http://deposit.dnb.de/cgi-bin/dokserv?id=63ca79410bce4a918eb6b9d1bdd31d54&prov=M&dok_var=1&dok_ext=htm	-	-
Markenrecht : Strategie, Anmeldung, Schutz und Verteidigung von Marken	-	von Dr. Senta Bingener	C.H. Beck	München	2022	-	9783406766213; 3406766218	4. Auflage	(Festeinband : EUR 69.00 (DE))	XXV, 313 Seiten	25 cm, 726 g	-	-	-	-	-	Band	22,A13; 20,N51	340	Markenrecht	346.430488	https://d-nb.info/1223039978/04	http://deposit.dnb.de/cgi-bin/dokserv?id=3981e86fce7d4b358313604c0782756f&prov=M&dok_var=1&dok_ext=htm	-	-
Designschutz in Deutschland und Europa : mit USA, Japan, China und Korea	-	von Prof. Dipl.-Ing. Dr. jur. Alexander Bulling, Patentanwalt, Stuttgart, Honorarprofessor der Universität Stuttgart  [und weiteren]	Carl Heymanns Verlag	Köln	2022	-	9783452296481; 3452296482	5. Auflage	(Festeinband : circa EUR 149.00 (DE), circa EUR 153.20 (AT))	XXI, 654 Seiten	22 cm, 994 g	-	-	-	-	-	Band	22,A13; 20,N51	340	Europäische Union; Geschmacksmusterrecht	346.430484; 346.240484	https://d-nb.info/1222917920/04	-	-	-
Beck'sches M & A-Handbuch : Planung, Gestaltung, Sonderformen, regulatorische Rahmenbedingungen und Streitbeilegung bei Mergers & Acquisitions	-	herausgegeben von Dr. Wolfgang Meyer-Sparenberg, Düsseldorf, Dr. Christof Jäckle, Frankfurt a.M. ; bearbeitet von Prof. Dr. Christian Aders, München; Dr. Christof Jäckle, Frankfurt a.M.; Dr. Wolfgang Meyer-Sparenberg, Hamburg/Düsseldorf Dr. [und 79 weiteren]	C.H. Beck; HLV	München; [Basel]	2022	-	9783406748011; 3406748015; 9783719036300	2. Auflage	Beck : (Gewebe : circa EUR 245.00 (DE)); Helbig Lichtenstein : (Gewebe)	XXXI, 2592 Seiten	24 cm, 1904 g	-	-	-	-	-	Band	22,A13; 20,N49	340	Mergers and Acquisitions; Recht	346.4306626	https://d-nb.info/1222367718/04	http://deposit.dnb.de/cgi-bin/dokserv?id=ed9ef6d913a74ae791a3d6749d330b7a&prov=M&dok_var=1&dok_ext=htm	-	-
Rechtsvergleichung als Erkenntnismethode : historische Perspektiven vom Spätmittelalter bis ins 19. Jahrhundert	-	Heinz Mohnhaupt	Vittorio Klostermann	Frankfurt am Main	2022	-	9783465045366; 346504536X	-	(Broschur : circa EUR 59.00 (DE), circa EUR 60.70 (AT))	IX, 247 Seiten	24 cm, 421 g	-	Studien zur europäischen Rechtsgeschichte ; Band 328	-	Erscheint auch als: Online-Ausgabe	-	Band	22,A13; 20,N39	340	Rechtsvergleich	340.2	https://d-nb.info/1217863249/04	-	-	-
Münchener Handbuch zum Arbeitsrecht : Kollektives Arbeitsrecht I	-	herausgegeben von Dr. Heinrich Kiel (Vorsitzender Richter am Bundesarbeitsgericht, Honorarprofessor an der Universität Hannover), Dr. Stefan Lunk (Rechtsanwalt und Fachanwalt für Arbeitsrecht, Hamburg, Honorarprofessor an der Universität zu Kiel), Dr. Hartmut Oetker (Professor an der Universität zu Kiel, Richter am Thüringer Oberlandesgericht) ; die Bearbeiter/-innen des dritten Bandes Dr. Burkhard Boemke (Professor an der Universität Leipzig), Dr. Stefan Lunk (Rechtsanwalt, Fachanwalt für Arbeitsrecht, Hamburg, Honorarprofessor an der Universität zu Kiel) [und 10 weitere]	C.H. Beck	München	2022	-	9783406753930; 3406753930	5. Auflage	(Gewebe : circa EUR 174.00 (DE))	LXIII, 1848 Seiten	25 cm, 2045 g	-	-	-	-	-	Band	22,A13; 20,N37	340	Kollektives Arbeitsrecht	344.430188	https://d-nb.info/1217133631/04	-	-	-
Gemeinnützige Unternehmen und Konzerne : Recht, Steuern, Management	-	herausgegeben von Prof. Dr. Stephan Schauhoff, Uwe Ufer ; bearbeitet von Prof. Dr. Stephan Schauhoff (Rechtsanwalt und Fachanwalt für Steuerrecht in Bonn), Uwe Ufer (Vorstand in Köln), Christopher Bensch (Syndikus-Steuerberater in Köln), Dr. Mathis Kampermann (Rechtsanwalt in Bonn), Dr. Eva-Maria Kraus (Rechtsanwältin und Steuerberaterin in Bonn)	C.H. Beck	München	2022	-	9783406744426; 3406744427	-	(Festeinband : circa EUR 39.00 (DE))	XXV, 339 Seiten	25 cm, 756 g	-	-	"Mit den grundlegenden Änderungen durch das JStG 2020" - Titelzusatz auf der Banderole	-	-	Band	22,A13; 20,N37	340	Unternehmen; Konzern; Gemeinnützigkeit; Management; Steuerrecht	346.43064	https://d-nb.info/1217132716/04	http://deposit.dnb.de/cgi-bin/dokserv?id=96af4a1cb1c44f7e833caefa51c58fb6&prov=M&dok_var=1&dok_ext=htm	-	-
Handbuch der Vermögensverwaltung in Deutschland, der Schweiz, Österreich und Liechtenstein	Handbuch Vermögensverwaltung	herausgegeben von Prof. Dr. Frank A. Schäfer, LL. M. (UCLA), Rechtsanwalt in Düsseldorf, Honorarprofessor an der Ruhr-Universität Bochum; Prof. Dr. Rolf Sethe, LL. M. (London), Ordinarius an der Universität Zürich, Rechtsanwalt in Zürich; Dr. Volker Lang, wissenschaftlicher Mitarbeiter in Bonn ; Prof. Dr. Peter Balzer, Dr. Volker Lang, Prof. Dr. Frank A. Schäfer, Prof. Dr. Rolf Sethe [und weitere]	HLV; C.H. Beck; Linde	[Basel]; München; [Wien]	2022	-	9783406747168; 9783719042875; 9783707333343; 3406747167; 3719042871; 3707333345	3. Auflage	Beck : (Gewebe : circa EUR 229.00 (DE)); Helbing Lichtenhahn : (Gewebe); Linde : (Gewebe); Beck; Helbing Lichtenhahn; Linde	LIX, 1191 Seiten	25 cm, 1702 g	-	-	-	-	-	Band	22,A13; 20,N36	340	Vermögensverwaltung; Recht	346.430926	https://d-nb.info/1216720932/04	http://deposit.dnb.de/cgi-bin/dokserv?id=a88c4cb15b264e60b8e1b359ce33c70c&prov=M&dok_var=1&dok_ext=htm	-	-
Aktiengesetz : Kommentar	-	herausgegeben von Dr. Wolfgang Hölters (Rechtsanwalt in Düsseldorf) und Dr. Markus Weber (Rechtsanwalt in Düsseldorf) ; Bearbeiterverzeichnis Dr. Michael Albrecht vom Kolke (Rechtsanwalt in München), Dr. Wolfgang Hölters (Rechtsanwalt in Düsseldorf), Dr. Markus Weber (Rechtsanwalt in Düsseldorf) [und 17 weitere]	C.H. Beck; Verlag Vahlen	München	2022	-	9783800663576; 3800663570	4. Auflage	(Festeinband : circa EUR 289.00 (DE))	XLVI, 2959 Seiten	25 cm, 2222 g	-	-	-	-	-	Band	22,A13; 20,N12	340	Deutschland	346.43066	https://d-nb.info/1206364009/04	-	-	-
Grunderwerbsteuergesetz : Kommentar	-	Viskorf ; bearbeitet von Dr. Anette Kugelmüller-Pugh (Richterin am Bundesfinanzhof), Prof. Dr. Matthias Loose (Richter am Bundesfinanzhof), Christine Meßbacher-Hönsch (Vizepräsidentin des Bundesfinanzhofs a. D.), Hermann-Ulrich Viskorf (Vizepräsident des Bundesfinanzhofs a. D.)	C.H. Beck	München	2022	-	9783406753879; 3406753876	20. Auflage	(Gewebe : circa EUR 139.00 (DE))	XX, 877 Seiten	25 cm, 1594 g	-	Beck'sche Steuerkommentare	-	-	-	Band	22,A13; 20,N06	340	Deutschland	343.430546	https://d-nb.info/1203760418/04	-	-	-
BGB : Sachenrecht : § 854-1296	-	herausgegeben von Prof. Dr. Dr. Herbert Grziwotz (Notar a.D., Regen), Prof. Dr. Johanna Schmidt-Räntsch (Kontollbeauftragte beim Unabhängigen Kontrollrat, Richter am Bundesgerichtshof a.D., Berlin), Prof. Dr. Gerhard Ring (Technische Universität Bergakademie Freiberg, Lehrstuhl für bürgerliches Recht, deutsches und europäisches Wirtschaftsrecht) in Verbindung mit dem Deutschen Anwaltverein ; Autorenverzeichnis Prof Roland Böttcher (Hochschule für Wirtschaft und Recht Berlin, Fachbereich Rechtspflege, Professur für Bürgerliches Recht mit dem Schwerpunkt Liegenschaftsrecht), Prof. Dr. Heribert Grziwotz (Notar in Regen und Zwiesel, Honorarprofessor an der Universität Regensburg), Prof. Dr. Gerhard Ring (Technische Universität Bergakademie Freiberg, Lehrstuhl für bürgerliches Recht, deutsches und europäisches Wirtschaftsrecht), Prof. Dr. Johanna Schmidt-Räntsch (Kontollbeauftragte bei dem Unabhängigen Kontrollrat, zuvor langjährige Richterin am Bundesgerichtshof, Honorarprofessorin an der Humboldt Universität zu Berlin) [und 36 weiteren]	Nomos	Baden-Baden	2022	-	9783848748877; 3848748878	5. Auflage	(Festeinband : circa EUR 218.00 (DE))	XXIX, 2734 Seiten	25 cm, 1894 g	-	Nomos Kommentar	-	-	-	Band	22,A13; 19,N40	340	Sachenrecht	346.4304	https://d-nb.info/1195725302/04	http://deposit.dnb.de/cgi-bin/dokserv?id=909c47f12fdc43d5a95ed676667197cc&prov=M&dok_var=1&dok_ext=htm	-	-
Digitalisierung, Globalisierung und Risikoprävention : Festschrift für Ulrich Sieber zum 70. Geburtstag	-	herausgegeben von Marc Engelhart, Hans Kudlich und Benjamin Vogel	Duncker & Humboldt	Berlin	2021	-	9783428159710	-	(Festeinband)	2 Bände	24 cm	-	Schriften zum Strafrecht ; Band 373	-	-	-	Band	22,A13	340	Strafrecht; Wirtschaftsstrafrecht; Computerkriminalität; Strafverfahrensrecht; Sieber, Ulrich	345.430268; 343.430999	-	-	-	-
Rechtswörterbuch Zivilprozessrecht	-	Richard Holzhammer	Plöchl Verlag	Freistadt	2021	-	-	-	-	Bände	25 cm	-	Linzer Universitätsschriften. Studientexte	-	-	-	Band	22,A13	340	Zivilprozessrecht	347.4360503	-	-	-	-
Rechtliche Rahmenbedingungen des Geschäftsmodells Loan-to-own im Lichte der Reformbestrebungen zur Bekämpfung von notleidenden Krediten auf europäischer und nationaler Ebene	-	Peter Stainer	GRIN Verlag	München	2021	-	9783346336712	-	(Broschur)	XXII, 299 Seiten	21 cm	-	-	-	Erscheint auch als: Online-Ausgabe	Dissertation; Universität Bayreuth2020	Band	22,A13	340	Unternehmenskrise; Unternehmenskauf; Kredit; Zweifelhafte Forderung; Europäische Union; Transformation	346.2406626; 346.4306626	https://d-nb.info/1251255477/04	-	-	-
Geteilte Verantwortung beim globalen Klimaschutz : historische, aktuelle und treuhänderische Haftung in Industrie-, Schwellen- und Entwicklungsländern	-	Autoren Claudia Härterich, Hauke Hartmann, Thieß Petersen ; GED	Bertelsmann Stiftung	Gütersloh	2021	-	-	-	-	35 Seiten	30 cm	-	BTI transformation index	-	Erscheint auch als: Online-Ausgabe	-	Band	22,A13	360; 340	-	-	https://d-nb.info/124705120X/04	-	-	-
Sonderheft Energierechtstag 2021	-	Schriftleitung + Redaktion Stefan Storr und Karl Stöger	Manz	Wien	2021	-	-	-	-	Seite 81-103	30 cm	-	-	-	-	-	Band	22,A13	340	Energierecht	343.436092	https://d-nb.info/1246473798/04	-	-	-
Digitalisierung, Globalisierung und Risikoprävention	-	-	Duncker & Humboldt	Berlin	2021	-	9783428159710	-	(Festeinband)	XI Seiten, Seite 682-1476	24 cm	-	-	-	-	-	Band	22,A13	340	-	-	https://d-nb.info/124321807X/04	-	-	-
Digitalisierung, Globalisierung und Risikoprävention	-	-	Duncker & Humboldt	Berlin	2021	-	9783428159710	-	(Festeinband)	XXI, 677 Seiten	24 cm	-	-	-	-	-	Band	22,A13	340	-	-	https://d-nb.info/1243217987/04	-	-	-
Rechtswörterbuch Zivilprozessrecht : Streitiges Erkenntnisverfahren	-	-	Plöchl Verlag	Freistadt	2021	-	9783901407789	8. Auflage	(Festeinband)	127 Seiten	25 cm	-	-	-	-	-	Band	22,A13	340	-	-	-	-	-	-
ASSEX Karteikarten Öffentliches Recht : das Prüfungswissen in Karteikartenform mit länderspezifischen Formalien	ASSEX Karteikarten Öffentliches Recht$4Berlin	-	Jura-Intensiv Verlags UG & Co. KG	[Frankfurt am Main]	2021	-	-	2. Auflage	-	750 Seiten	11 x 15 cm, in Behältnis 15 x 17 x 10 cm, 1500 g	-	Jura intensiv	-	-	-	Blatt	22,A13	340	Öffentliches Recht; Juristische Staatsprüfung 2	342.430076	-	-	-	-
ASSEX Karteikarten Strafrecht : das Prüfungswissen in Karteikartenform mit länderspezifischen Formalien zur StA-Klausur	-	-	Jura-Intensiv Verlags UG & Co. KG	[Frankfurt am Main]	2021	-	-	1. Auflage	-	794 Seiten	11 x 15 cm, in Behältnis 26 x 17 x 12 cm, 1500 g	-	Jura intensiv	-	-	-	Blatt	22,A13	340	Strafrecht; Prüfungsvorbereitung; Juristische Staatsprüfung 2	345.430076	-	-	-	-
ASSEX Karteikarten Öffentliches Recht : das Prüfungswissen in Karteikartenform mit länderspezifischen Formalien	ASSEX Karteikarten Öffentliches Recht$4Brandenburg	-	Jura-Intensiv Verlags UG & Co. KG	[Frankfurt am Main]	2021	-	-	2. Auflage	-	762 Seiten	11 x 15 cm, in Behältnis 15 x 17 x 10 cm, 1500 g	-	Jura intensiv	-	-	-	Blatt	22,A13	340	Öffentliches Recht; Juristische Staatsprüfung 2	342.430076	-	-	-	-
ASSEX Karteikarten Öffentliches Recht : das Prüfungswissen in Karteikartenform mit länderspezifischen Formalien	ASSEX Karteikarten Öffentliches Recht$4Rheinland-Pfalz	-	Jura-Intensiv Verlags UG & Co. KG	[Frankfurt am Main]	2021	-	-	1. Auflage	-	828 Seiten	11 x 15 cm, in Behältnis 26 x 17 x 12 cm, 1500 g	-	Jura intensiv	-	-	-	Blatt	22,A13	340	Öffentliches Recht; Juristische Staatsprüfung 2	342.430076	-	-	-	-
ASSEX Karteikarten Arbeits- & Wirtschaftsrecht : das Prüfungswissen in Karteikartenform	-	-	Jura-Intensiv Verlag UG & Co. KG	[Frankfurt am Main]	2021	-	-	2. Auflage	-	408 Seiten	11 x 15 cm, in Behältnis 15 x 17 x 12 cm	-	Jura intensiv	-	-	-	Blatt	22,A13	340	Arbeitsrecht; Juristische Staatsprüfung 2; Wirtschaftsrecht	344.4301076; 343.43076	-	-	-	-
Muster für eine Anlagerichtlinie für Geldanlagen	-	Horst Meffert, Referent für Finanzen beim Gemeinde- und Städtebund Rheinland-Pfalz	GStB, Gemeinde- und Städtebund Rheinland-Pfalz	[Mainz]	2021	-	-	-	-	7 Seiten	30 cm	-	Gemeinde und Stadt ; 2021, 4 zu Heft 5/2021. [...], Beilage	-	-	-	Band	22,A13	340; 350	-	-	-	-	-	-
Patientenrecht Zweitmeinung : einfach und verständlich erklärt	-	Volker Nürnberg, Marie-Theres Meier	Springer Fachmedien Wiesbaden GmbH	Wiesbaden	2021	-	9783658144258; 3658144254	-	(Broschur : circa EUR 14.99 (DE), circa EUR 15.41 (AT), circa CHF 17.00 (freier Preis))	XII, 129 Seiten	21 cm, 198 g	-	Sachbuch	-	Erscheint auch als: Online-Ausgabe	-	Band	22,A13; 19,N01	340; 610; 360	Ärztliche Zweitmeinung; Anspruch	344.43041	https://d-nb.info/1173819770/04	http://deposit.dnb.de/cgi-bin/dokserv?id=3559ea1ce56345e491b015151dcfc634&prov=M&dok_var=1&dok_ext=htm	-	-
Recht in Ausbildung und Praxis bei den Gerichten und Staatsanwaltschaften ; Nr. 25 : Handbuch für Ausbildung und Praxis im Justizwachtmeisterdienst	-	JSOG/Sicherheitsrecht von Rainer Friedlein (RiAG Bayreuth), Zugangskontrollen und Waffenrecht von  Peter Pöhlmann (VorsRiLG Landshut), Ausweispapiere von Hilmar Schelhorn (Justizsicherheitshauptsekretär Bambert), Zustellungsrecht von Sven Schultze (Justizverwaltungsamtsrat, OLG München, Ausbildungsleiter für den Gerichtsvollzieherdienst), materielles Strafrecht von Silvia Eger (Dipl.-RPflin FH, Bay. Justizakademie Pegnitz), formelles Strafrecht von Petra Kunte (Dipl.-RPflin FH, OLG München)	Juristischer Verlag Pegnitz	Pegnitz	2021	-	9783948836146; 3948836140	Rechtsstand : November 2021	(Broschur : EUR 26.00 (DE), EUR 26.80 (AT))	274 Seiten	25 cm, 420 g	-	-	"8. Auflage" - Umschlag und Impressum	-	-	Band	22,A13; 22,N04	340	Justizdienst; Ausbildung; Weiterbildung	347.43016	https://d-nb.info/1249944759/04	http://www.juristischer-verlag-pegnitz.de/Lehrbuecher/Handbuch-fuer-die-Ausbildung-und-Praxis-im-Justizwachtmeisterdienst.html	-	-
Die Architektur des internationalen Wirtschaftsrechts : Grundlagen und Ausblicke	Diritto del commercio internzazionale	Alberto Mazzoni, Maria Chiara Malaguti ; Übersetzung von Caterina R. Foti	G. Giappichelli; Nomos	Torino; Baden-Baden	2021	-	9783848787203; 9788892138834; 3848787202	-	(Broschur : EUR 48.00 (DE))	XX, 270 Seiten	24 cm, 519 g	-	-	-	-	-	Band	22,A13; 22,N03	340	Internationales Wirtschaftsrecht	343.07	https://d-nb.info/1249237254/04	http://deposit.dnb.de/cgi-bin/dokserv?id=fd125a79241b4d839e1d67adcc1af149&prov=M&dok_var=1&dok_ext=htm	-	-
Schutz der Gesellschafter in den Sanierungsplanverfahren deutschen, französischen und englischen Rechts	-	von Carla Maier	RWS Verlag Kommunikationsforum GmbH & Co. KG	Köln	2021	-	9783814507507; 3814507509	-	(Broschur : EUR 43.00 (DE), EUR 44.30 (AT))	XXXII, 129 Seiten	23 cm, 217 g	-	-	-	Erscheint auch als: Online-Ausgabe	-	Band	22,A13; 21,N47	340	Unternehmenssanierung; Restrukturierung; Gesellschafterschutz; Rechtsvergleich	346.43078; 346.42078; 346.44078	https://d-nb.info/1246098105/04	-	-	-
Der Insolvenzverwalter im Liquidationsverfahren nach Chapter 7 des United States Bankruptcy Code	-	von Niklas Keller, Köln	RWS Verlag Kommunikationsforum GmbH	Köln	2021	-	9783814507491; 3814507495	-	(Broschur : EUR 38.00 (DE), EUR 39.10 (AT))	XXXI, 115 Seiten	23 cm, 200 g	-	-	-	Erscheint auch als: Online-Ausgabe	-	Band	22,A13; 21,N47	340	Insolvenzverwalter; Insolvenzrecht	346.73078	https://d-nb.info/1246097699/04	-	-	-
Rechtswissenschaft zwischen Industrialisierung und Republik : Josef Kohler (1849-1919)	-	herausgegeben von Eva Inés Obergfell und Louis Pahlow	Mohr Siebeck	Tübingen	2021	-	9783161609879; 3161609875	-	(Broschur : EUR 49.00 (DE))	XII, 184 Seiten	24 cm, 309 g	-	Grundlagen der Rechtswissenschaft ; 40	Beiträge des 5. Josef Kohler-Symposions 2019 in Berlin (Vorwort)	Erscheint auch als: Online-Ausgabe	-	Band	22,A13; 21,N44	340	Kohler, Josef; Rechtsphilosophie; Rechtsethnologie; Immaterialgüterrecht; Zivilprozessrecht; Völkerrecht	340.09034	https://d-nb.info/1244642169/04	http://deposit.dnb.de/cgi-bin/dokserv?id=353a920892d34bb7b5b4648a9ae62571&prov=M&dok_var=1&dok_ext=htm	-	-
Betriebssicherheit - eine Vorschriftensammlung	-	[Deutschland] ; Antonius Spier, Karl Westermann (Hrsg.)	TÜV Media GmbH, TÜV Rheinland Group	Köln	2021	-	9783740606756; 3740606754	17. aktualisierte Auflage	(Broschur : EUR 26.40 (DE), EUR 23.76 (DE) (Sonderpreis), EUR 19.80 (DE) (Sonderpreis), EUR 18.48 (DE) (Sonderpreis), EUR 21.12 (DE) (Sonderpreis), EUR 27.20 (AT))	1024 Seiten	15 cm, 481 g	-	-	-	Erscheint auch als: Online-Ausgabe	-	Band	22,A13; 21,N44	340	Betriebssicherheit; Recht	344.4304650263	https://d-nb.info/1244561223/04	http://deposit.dnb.de/cgi-bin/dokserv?id=d17d8e1e087545ccba7c9ca1891b5717&prov=M&dok_var=1&dok_ext=htm	-	-
Strafrecht und Empirie : Beiträge zur internationalen Strafrechtswissenschaft	-	Su Jiang	Mohr Siebeck	Tübingen	2021	-	9783161609008; 316160900X	-	(Broschur : EUR 79.00 (DE))	X, 304 Seiten	24 cm, 481 g	-	Schriften zum ostasiatischen Strafrecht ; 9	-	Erscheint auch als: Online-Ausgabe	-	Band	22,A13; 21,N44	340	Strafrechtsdogmatik; Strafe; Internetkriminalität; Strafrichter; Entscheidungsfindung; Künstliche Intelligenz; Entscheidungsunterstützung; Rechtsvergleich; Strafzumessung; Strafrechtsreform	345.51; 345.7301028563; 345.430773	https://d-nb.info/1244448338/04	http://deposit.dnb.de/cgi-bin/dokserv?id=07027fd2633d4dcea866350a33157935&prov=M&dok_var=1&dok_ext=htm	-	-
DataPolitics : zum Umgang mit Daten im digitalen Zeitalter	-	Martina Bachor, Theo Hug, Günther Pallaver (Hg.)	innsbruck university press	Innsbruck	2021	-	9783991060468; 3991060469	1. Auflage	(Broschur : EUR 28.90 (DE), EUR 28.90 (AT))	186 Seiten	22 cm, 340 g	-	Edited volume series	-	-	-	Band	22,A13; 21,N44	300; 340	Informationsgesellschaft; Big Data; Personenbezogene Daten; Privatheit; Datenschutz; Selbstbestimmung	303.4833	https://d-nb.info/1244437689/04	-	-	-
Paradigmenwechsel im Verwaltungsstrafrecht? : Herbsttagung der Österreichischen Juristenkommission am 23. Oktober 2018 im Stadtsenatssitzungssaal des Wiener Rathauses : Vorträge und Diskussionen	-	Herausgeber Dr. Armin Bammer für die Österreichische Juristenkommission	Linde	Wien	2021	-	9783707344325; 3707344320	-	(Broschur : EUR 22.00 (DE), EUR 22.00 (AT), CHF 38.60 (freier Preis))	VII, 60 Seiten	23 cm, 150 g	-	Kritik und Fortschritt im Rechtsstaat ; Band 52	-	-	-	Band	22,A13; 21,N42	340	Verwaltungsstrafrecht	342.4360664; 345.436	https://d-nb.info/1243190833/04	http://deposit.dnb.de/cgi-bin/dokserv?id=d3e9075aa4b142eab1100ee8038c00bd&prov=M&dok_var=1&dok_ext=htm	-	-
Schulrecht 2021/22 : ein systematischer Überblick	-	von Dr. Armin Andergassen, Bildungsdirektion für Tirol, Präsidialleiter-Stellvertreter und Leiter der Abteilung Recht	MANZ'sche Verlags- und Universitätsbuchhandlung	Wien	2021	-	9783214093297; 3214093290	6. Auflage, auf Grundlage der 1., von Prof. DDr. Karl Heinz Auer mitbegründeten Auflage, Stand: 1. September 2021	(Broschur : circa EUR 38.00 (DE), circa EUR 38.00 (AT), circa EUR 30.40 (AT) (Sonderpreis: Abonnementpreis), circa EUR 30.40 (AT) (Sonderpreis: Hörerscheinpreis))	XXXIII, 360 Seiten	23 cm, 571 g	-	-	-	-	-	Band	22,A13; 21,N40	340	Schulrecht	344.43604	https://d-nb.info/1242283633/04	-	-	-
Die Einrichtung völkervertraglicher Gremien : Entwicklung eines unionsrechtlichen Legitimationssystems mit Bezügen zum Grundgesetz	-	Franziska Hobmaier	Mohr Siebeck	Tübingen	2021	-	9783161609664; 3161609662	-	(Broschur : EUR 79.00 (DE))	XXIV, 324 Seiten	23 cm, 524 g	-	Jus internationale et Europaeum ; 179	-	Erscheint auch als: Online-Ausgabe	Dissertation; Ludwig-Maximilians-Universität München2021	Band	22,A13; 21,N40	340	Europäische Union; Kooperationsabkommen; Gemischtes Abkommen; Gremium; Zuständigkeit; Legitimation; CETA	341.37094; 341.370943	https://d-nb.info/1242194460/04	http://deposit.dnb.de/cgi-bin/dokserv?id=cd4b576c60034c98b11f7bf17dea198f&prov=M&dok_var=1&dok_ext=htm	-	-
Heiz- und Kältekostenabrechnungsgesetz (HeizKG) : Kurzkommentar	Heiz- und Kältekostenabrechnungsgesetz (HeizKG)	bearbeitet von Dr. Christian Prader (Rechtsanwalt, Innsbruck), MMag. Dr. Benjamin Dobler (Richter des Landgerichts Innsbruck)	MANZ'sche Verlags- und Universitätsbuchhandlung	Wien	2021	-	9783214021528; 3214021524	-	(Festeinband : circa EUR 54.00 (DE), circa EUR 54.00 (AT))	XVII, 183 Seiten	21 cm, 305 g	-	Manzsche Kurzkommentare	-	-	-	Band	22,A13; 21,N39	340	Österreich	346.43604344	https://d-nb.info/1241837384/04	-	-	-
Abwehrbeschlüsse der Generalversammlung	-	vorgelegt von Christian Moser	Dike Verlag	Zürich	2021	-	9783038913788; 3038913782	-	(Broschur : EUR 109.00 (DE), EUR 109.00 (AT), CHF 104.00 (freier Preis))	XLV, 504 Seiten	23 cm, 814 g	-	Schweizer Schriften zum Handels- und Wirtschaftsrecht ; Band 355	-	-	Dissertation; Universität Zürich2021	Band	22,A13; 21,N39	340	-	-	https://d-nb.info/1241684472/04	-	-	-
Richterinnen an Schweizer Gerichten : Völker-, verfassungs- und gesetzesrechtliche Grundlagen, empirische Analyse sowie Förderungsmassnahmen	-	Dr. Nina Ochsenbein	Stämpfli Verlag; Nomos; Verlag Österreich	Bern; Baden-Baden; Wien	2021	-	9783727228445; 372722844X; 9783848785766; 9783704688439	-	Stämpfli Verlag : (Broschur : circa EUR 85.80 (DE), circa EUR 88.30 (AT), circa CHF 75.00 (freier Preis)); Nomos : circa  EUR 86.00 (DE); Verlag Österreich : EUR 70.31 (DE), EUR 69.00 (AT)	XLVI, 235 Seiten	23 cm, 477 g	-	Schriftenreihe zur Justizforschung ; Band 19	-	Erscheint auch als: Online-Ausgabe	Dissertation; Universität Bern2021	Band	22,A13; 21,N38	340	Richterin; Geschlechterverhältnis; Quote; Frauenförderung	347.494014092	https://d-nb.info/1241267669/04	http://deposit.dnb.de/cgi-bin/dokserv?id=856c51405e254fc699694d0a1e854dc5&prov=M&dok_var=1&dok_ext=htm; http://deposit.dnb.de/cgi-bin/dokserv?id=12d2027147c5443081bf1181aedca6b9&prov=M&dok_var=1&dok_ext=htm	-	-
Handlungsoptionen zur Gestaltung des regulatorischen und energierechtlichen Rahmens im enera-Projekt : Abschlussbericht : im Rahmen des vom Bundesministeriums für Wirtschaft und Energie geförderten SINTEG-Projekts enera (Förderkennzeichen 03SIN307)	-	Prof. Dr. jur. Hartmut Weyer, Dipl.-Jur. Thore Iversen	Cuvillier Verlag	Göttingen	2021	-	9783736974869; 3736974868	1. Auflage	(Broschur : EUR 49.90 (DE), EUR 51.30 (AT))	xiii, 174 Seiten	21 cm	-	Schriftenreihe des Energie-Forschungszentrums Niedersachsen ; Band 71	-	-	-	Band	22,A13; 21,N38	340; 333.7	Elektrizitätsversorgungsnetz; Engpassplanung; Lastverteilung; Spitzenlast; Energierecht	343.4359170929	https://d-nb.info/124120389X/04	-	-	-
Der Begriff des wirtschaftlich Berechtigten im Rahmen der transparenzregisterrechtlichen Regelungen des Geldwäschegesetzes	-	Jens Klapdor	Nomos	Baden-Baden	2021	-	9783848786749; 3848786745	1. Auflage	(Festeinband : EUR 178.00 (DE))	639 Seiten	23 cm, 995 g	-	Schriften zum europäischen, internationalen und vergleichenden Unternehmens- und Wirtschaftsrecht ; Band 24	-	-	Dissertation; Universität Bayreuth2021	Band	22,A13; 21,N38	340	Internationaler Terrorismus; Finanzierung; Geldwäsche; Bekämpfung; Compliance-System; Europäische Union; Transformation	345.430268	https://d-nb.info/1241203458/04	http://deposit.dnb.de/cgi-bin/dokserv?id=a8ce93ef4c3040bfaab5389abf960b16&prov=M&dok_var=1&dok_ext=htm	-	-
Der genuine link im Internationalen Steuerrecht - Analyse und Systematisierung der Anknüpfungspunkte des § 49 Abs. 1 EStG	-	vorgelegt von Marcel Pohlmann	sierke VERLAG	Göttingen	2021	-	9783965480865; 3965480863	1. Auflage	(Broschur : EUR 52.00 (DE), EUR 53.50 (AT))	368 Seiten	21 cm, 678 g	-	-	-	-	Dissertation; Universität Osnabrück2020	Band	22,A13; 21,N38	340	Einkommensteuer; Beschränkte Steuerpflicht; Anknüpfung; Inland; Internationales Steuerrecht	343.4304	https://d-nb.info/1241203113/04	-	-	-
Einfluss der Landesverfassungen und ausländischer Verfassungen auf die Grundrechte des Grundgesetzes : eine verfassungshistorische Analyse	Einfluss der Landesverfassungen und ausländischer Verfassungen auf die Grundrechte des Grundgesetzes der Bundesrepublik Deutschland	Florian Schulze	Nomos	Baden-Baden	2021	-	9783848783991; 3848783991	1. Auflage	(Broschur : EUR 78.00 (DE))	273 Seiten	23 cm, 405 g	-	Münsterische Beiträge zur Rechtswissenschaft ; Neue Folge, Band 62	-	-	Dissertation; Westfälische Wilhelms-Universität Münster2021	Band	22,A13; 21,N37	340	Landesverfassung; Grundrecht; Rezeption; Deutschland	342.430209044; 342.4304209044	https://d-nb.info/1240990375/04	http://deposit.dnb.de/cgi-bin/dokserv?id=d0e71ba74397453aa4c23a0f649a0ed3&prov=M&dok_var=1&dok_ext=htm	-	-
