Titel	Werktitel	Verfasser	Verlag	Verlagsort	Erscheinungsjahr	Erscheinungstermin	ISBN	Auflage	Preis	Seiten	Maß	Begleitmaterial	Reihe	Fußnote	Parallele Ausgabe	Hochschulschriftenvermerk	Datenträger	Wochenverzeichnisnummer	DDC-Sachgruppe	Schlagworte	Vollständige DDC-Notation	Inhaltsverzeichnis	Inhaltstext	Links	Desiderat
DIN CEN/TS 16931-3-3, Elektronische Rechnungsstellung. Teil 3-3, Umsetzung in die Syntax UN/CEFACT XML Cross Industry Invoice D16B	DIN CEN/TS 16931	DIN, Deutsches Institut für Normung e.V. ; DIN-Normenausschuss Informationstechnik und Anwendungen (NIA)	Beuth Verlag GmbH	Berlin	2021	-	-	Deutsche Fassung CEN/TS 16931-3-3:2020	-	4, 221 Seiten	30 cm	-	Technische Spezifikation	Ersatz für DIN CEN/TS 16931-3-3 (DIN SPEC 16578-3-3):2019-01	-	-	Band	22,A13	600	-	-	-	-	-	-
DIN EN 16803-3, Raumfahrt - Anwendung von GNSS-basierter Ortung für Intelligente Transportsysteme (ITS) im Straßenverkehr. Teil 3, Überprüfung der sicheren Leistungen von GNSS-basierten Ortungsendgeräten	DIN EN 16803	DIN, Deutsches Institut für Normung e.V. ; DIN-Normenausschuss Luft- und Raumfahrt (NL)	Beuth Verlag GmbH	Berlin	2021	-	-	Deutsche Fassung EN 16803-3:2020	-	2, 58 Seiten	30 cm	-	Deutsche Norm	-	-	-	Band	22,A13	600	-	-	-	-	-	-
Amivantamab (Rybrevant) beim nicht-kleinzelligen Lungenkarzinom (NSCLC) : erste zielgerichtete Therapie bei EGFR-Exon-20-Insertionsmutationen	-	-	Thieme	Stuttart	2022	-	-	-	-	11 Seiten	27 cm	-	Drug Report	-	-	-	Band	22,A13	610	-	-	https://d-nb.info/125354929X/04	-	-	-
Versionen des Selbst : komplexes Identitätserleben als klinische und gesellschaftliche Herausforderung	-	Gudrun Prinz/Andrea Harms/Erich Lehner (Hrsg.)	Brandes & Apsel	Frankfurt a.M., Deutschland	2022	-	9783955583231; 3955583236	-	(Broschur : circa EUR 39.90 (DE), circa EUR 41.10 (AT))	310 Seiten	24 cm	-	Jahrbuch Selbstpsychologie ; [N.F.] Band 4	-	-	-	Band	22,A13; 21,N47	610; 150	Identität; Selbst-Psychologie; Psychoanalytiker	616.8917	https://d-nb.info/1253537658/04	-	-	-
Nanoengineering of biomaterials	-	edited by Sougata Jana and Subrata Jana	Wiley-VCH	Weinheim, Germany	2022	-	9783527349043; 3527349049	-	(Festeinband : circa EUR 229.00 (DE) (freier Preis))	2 Bände	25 cm, 2316 g	-	-	-	Erscheint auch als: Online-Ausgabe	-	Band	22,A13	610; 540; 620	Biomaterial; Therapeutisches System; Nanotechnologie	615.19; 610.284	-	-	-	-
Nanoengineering of biomaterials : Biomedical applications	-	-	Wiley-VCH	Weinheim, Germany	2022	-	9783527349043	-	(Festeinband : circa EUR 229.00 (DE) (freier Preis))	xv, 464 Seiten	-	-	-	-	-	-	Band	22,A13	610; 540; 620	-	-	https://d-nb.info/1251957382/04	-	-	-
Aromatherapie für Dummies : die Grundlagen der Aromatherapie kennenlernen : ätherische Öle richtig und sicher anwenden : die 25 wichtigsten ätherischen Öle im Portrait	Les huiles essentielles pour les nuls	Elske Miles ; Sprecherin: Carolin Kummer	abod	München	2022	-	9783954718757; 3954718758	Ungekürzte Lesefassung	EUR 16.95 (DE), EUR 17.50 (AT)	6 CDs	193 g	-	Lernen einfach gemacht	-	Erscheint auch als: Druck-Ausgabe	-	Audiodisk	22,A13; 22,N08	610	Aromatherapie	615.3219	-	-	-	-
Standardisierte Rezepturen : Formelsammlung für Ärzte	-	DAC/NRF-Redaktion unter Mitarbeit von Prof. Dr. med. Petra Staubach-Renz, Dr. rer. nat. Anette Schenk	Govi	Eschborn	2022	-	9783774115682; 3774115680	11. überarbeitete Auflage	(Broschur : EUR 22.90 (DE), EUR 23.60 (AT))	XIV, 171 Seiten	21 cm, 274 g	-	-	-	Erscheint auch als: Online-Ausgabe	-	Band	22,A13; 22,N07	610	Rezeptur; Standardisierung	615.1343	https://d-nb.info/1251505066/04	-	-	-
Gesunder und gestörter Schlaf : Praxiswissen für die Patientenberatung	-	Egid Strehl, Cordula Lebert	Avoxa - Mediengruppe Deutscher Apotheker GmbH	Eschborn	2022	-	9783774116092; 3774116091	Auflage 2022	(Broschur : EUR 24.90 (DE), EUR 25.60 (AT))	118 Seiten	24 cm, 270 g	-	Govi	-	Erscheint auch als: Online-Ausgabe	-	Band	22,A13; 22,N06	610; 360	Schlafstörung; Pharmakotherapie; Beratung; Apotheke	616.8498061	https://d-nb.info/1250936780/04	-	-	-
Die schlimmste und die beste Zeit meines Lebens - vom Schwindelarzt zum Verschwörungs-Sachverständigen	Vom Schwindelarzt zum Verschwörungs-Sachverständigen	Dr. Bodo Schiffmann ; gelesen vom Autor Dr. Bodo Schiffmann	Kamasha Verlag	Fulda	2022	-	9783936767636; 3936767637	[1. Auflage, ungekürzte Ausgabe]	EUR 21.00 (DE), EUR 21.60 (AT)	1 CD	-	1 Booklet (4 ungezählte Seiten)	Edition: Wissen und Weisheit	-	-	-	Audiodisk	22,A13; 22,N02	610; 360; 320	-	-	-	-	-	-
Taschenwissen Altenpflege	-	Angelika Ecker	Elsevier, Urban & Fischer	München	2022	-	9783437276460; 3437276468	2. Auflage	(Spiralbindung : EUR 18.00 (DE), EUR 18.50 (AT), CHF 25.00 (freier Preis))	circa V, 81 Seiten	173 g	-	-	-	Erscheint auch als: Online-Ausgabe	-	Band	22,A13; 21,N49	610	Altenpflege	618.970231	https://d-nb.info/1246928108/04	http://deposit.dnb.de/cgi-bin/dokserv?id=fbafc9534b6347609a337c18460288f6&prov=M&dok_var=1&dok_ext=htm	-	-
Mein Pflegeguide für den praktischen Einsatz : generalistisch - kompetenzorientiert - lernortübergreifend	-	Susanne Geppert	Elsevier	München	2022	-	9783437251078; 3437251074	2. Auflage	(Spiralbindung: circa EUR 30.00 (DE), circa EUR 30.90 (AT))	circa X, 390 Seiten	24 cm, 862 g	-	-	-	Erscheint auch als: Online-Ausgabe	-	Band	22,A13; 21,N49	610	Krankenpflege; Ausbildung	610.73071	https://d-nb.info/1246927276/04	http://deposit.dnb.de/cgi-bin/dokserv?id=cf129b790d81435f90a930557204dc16&prov=M&dok_var=1&dok_ext=htm	-	-
Deutung	-	Timo Storck	Verlag W. Kohlhammer	Stuttgart	2022	-	9783170412101; 3170412108	1. Auflage	(Broschur : circa EUR 36.00 (DE), circa EUR 37.10 (AT))	186 Seiten	21 cm, 227 g	-	Grundelemente psychodynamischen Denkens ; Band 8	-	Erscheint auch als: Online-Ausgabe	-	Band	22,A13; 21,N48	150; 610	Psychoanalyse; Deutung	150.195	https://d-nb.info/1246382423/04	-	-	-
Anatomie kompakt für Dummies	-	Donna Rae Siegfried ; Überarbeitung von Dr. Susanne Katharina Hemschemeier ; Fachkorrektur von Dr. Monika Kortenjann	Wiley-VCH GmbH	Weinheim	2022	-	9783527719396; 3527719393	2. überarbeitete Auflage	(Broschur : circa EUR 12.00 (DE))	269 Seiten	22 cm, 342 g	-	Lernen einfach gemacht	-	Erscheint auch als: Online-Ausgabe	-	Band	22,A13; 21,N47	610	-	611	https://d-nb.info/1246101297/04	-	-	-
Das erschöpfte Gehirn	-	Dr. med. Michael Nehls ; gelesen von Alexander Gamnitzer	Lagato	Leipzig	2022	-	9783955679309; 3955679306	-	EUR 17.90 (DE) (freier Preis), EUR 17.90 (AT) (freier Preis), CHF 21.50 (freier Preis)	1 CD	-	-	-	-	Erscheint auch als: Druck-Ausgabe	-	Audiodisk	22,A13; 21,N45	610; 150	Hirnfunktion; Erschöpfung; Gesunde Lebensführung	612.82; 613.79	-	-	-	-
Bewegung & Entspannung in der Kita	-	Redaktion Myriam Bork	Klett Kita GmbH	Stuttgart	2022	-	9783960461746; 3960461747	-	(Broschur : EUR 14.95 (DE), EUR 15.40 (AT))	79 Seiten	26 cm	-	Praxisideen für die Kita	Auf dem Umschlag: Die besten Spiele zum Mitmachen, Austoben und zur Ruhe kommen	-	-	Band	22,A13; 21,N44	370; 610	-	-	https://d-nb.info/1244502820/04	-	-	-
Mit Kindern zur Ruhe kommen : bedürfnisorientierte Begleitung von Schlaf und Erholung in Krippe und Kita	-	Christine Betz ; Margit Frank (Hrsg.)	Klett Kita GmbH	Stuttgart	2022	-	9783960462002; 396046200X	-	(Broschur : EUR 16.95 (DE), EUR 17.50 (AT))	96 Seiten	26 cm	-	Partizipation im Kita-Alltag leben	-	-	-	Band	22,A13; 21,N44	370; 610	-	-	https://d-nb.info/1244501921/04	-	-	-
Kinder essen im Ganztag : Wissen, Praxis und Projekte	Mittagessen pädagogisch gestalten	Holger Renner, Benjamin Perry, Manja Plehn	Herder	Freiburg; Basel; Wien	2022	-	9783451392238; 3451392232	2. ergänzte und überarbeitete Auflage	(Broschur : EUR 20.00 (DE), EUR 20.60 (AT), CHF 28.90 (freier Preis))	110 Seiten	24 cm, 294 g	-	Qualität in Hort, Schulkindbetreuung und Ganztagsschule; Praxis	-	Erscheint auch als: Online-Ausgabe	-	Band	22,A13; 21,N42	370; 610	Schüler; Gesunde Ernährung; Schulverpflegung; Lebensmittelqualität; Ganztagsschule; Betreuung; Hort	371.716	https://d-nb.info/1243011505/04	http://deposit.dnb.de/cgi-bin/dokserv?id=f6085c812c044d0db448ed173b6858fb&prov=M&dok_var=1&dok_ext=htm	-	-
Ware Weltgesundheit : vom Tuberkulinrausch zum Impfprivileg	-	Redaktion: Dorothee D'Aprile	TAZ	Berlin	2022	-	9783937683959; 393768395X	-	(Broschur : EUR 9.50 (DE), EUR 9.50 (AT), CHF 12.50 (freier Preis))	112 Seiten	28 cm, 358 g	-	Le monde diplomatique ; no 30. [...], Edition LMD	-	-	-	Band	22,A13; 21,N40	360; 610	Medizinische Versorgung; Infektionskrankheit; Impfung; Gesundheitspolitik; Nord-Süd-Beziehungen	362.1	https://d-nb.info/1242040730/04	-	-	-
Nachbesprechung von Zwangsmaßnahmen : ein Praxisleitfaden	-	Lieselotte Mahler, Alexandre Wullschleger, Anna Oster	Psychiatrie Verlag	Köln	2022	-	9783966051019; 396605101X	1. Auflage	(Broschur : EUR 30.00 (DE), EUR 30.90 (AT))	129 Seiten	24 cm	-	Psychosoziale Arbeitshilfen ; 42	-	Erscheint auch als: Online-Ausgabe	-	Band	22,A13; 21,N22	610; 150	Psychiatrische Klinik; Zwangsmaßnahme; Debriefing	616.891	https://d-nb.info/123425770X/04	-	-	-
Nanoengineering of biomaterials : Drug delivery	-	-	Wiley-VCH	Weinheim, Germany	2022	-	9783527349043	-	(Festeinband : circa EUR 229.00 (DE) (freier Preis))	xix, 556 Seiten	-	-	-	-	-	-	Band	22,A13; 21,N21	610; 540; 620	-	-	https://d-nb.info/1233894900/04	-	-	-
Vegane Ernährung für Einsteiger : das wichtigste Basiswissen und schnelle Rezepte	-	Sebastian Copien & Niko Rittenau	Dorling Kindersley Verlag GmbH	München	2022	-	9783831043255; 3831043256	-	(Festeinband : EUR 19.95 (DE), EUR 20.60 (AT))	271 Seiten	25 cm, 1016 g	-	-	-	Erscheint auch als: Online-Ausgabe	-	Band	22,A13; 21,N18	640; 610; 100	-	-	https://d-nb.info/123234186X/04	http://deposit.dnb.de/cgi-bin/dokserv?id=6269430199354457b6a267bc4a782df6&prov=M&dok_var=1&dok_ext=htm	-	-
Klimakrise und Gesundheit : zu den Risiken einer menschengemachten Dynamik für Leib und Seele	-	Martin Scherer/Josef Bergholf/Helmwart Hierdeis (Hg.)	Vandenhoeck & Ruprecht	Göttingen	2022	-	9783525407714; 3525407718	-	(Broschur : EUR 30.00 (DE), EUR 31.00 (AT))	213 Seiten	21 cm, 275 g	-	-	-	Erscheint auch als: Online-Ausgabe	-	Band	22,A13; 21,N12	610; 360; 150	Anthropogene Klimaänderung; Gesundheit; Psychische Belastung	616.988	https://d-nb.info/1229530568/04	-	-	-
Komplexität in der Psychotherapie : Psychotherapie klientengerecht und nachhaltig gestalten	-	Rainer Sachse	Hogrefe	Göttingen	2022	-	9783801731274; 3801731278	1. Auflage	(Broschur : circa EUR 34.95 (DE), circa CHF 44.39, circa CHF 45.50 (freier Preis))	295 Seiten	24 cm, 556 g	-	-	-	Erscheint auch als: Online-Ausgabe	-	Band	22,A13; 20,N52	610; 150	Psychotherapeutischer Prozess; Komplexität; Forschung; Psychotherapie; Wissenschaftstheorie; Erkenntnistheorie	616.8914	https://d-nb.info/1223792994/04	http://deposit.dnb.de/cgi-bin/dokserv?id=fb97566d405b47809b7b7a9355f827fe&prov=M&dok_var=1&dok_ext=htm	-	-
Die Kunst da zu sein : häufig, selten und nie gestellte Fragen zur Achtsamkeit	-	Michael Huppertz	Mabuse-Verlag	Frankfurt am Main	2022	-	9783863215552; 3863215559	-	(Broschur : circa EUR 24.95 (DE), circa EUR 25.70 (AT), circa CHF 32.50 (freier Preis))	298 Seiten	21 cm, 459 g	-	-	-	Erscheint auch als: Online-Ausgabe	-	Band	22,A13; 20,N43	150; 610; 290	Achtsamkeit; Aufmerksamkeit; Entspannung	158.12	https://d-nb.info/1219525332/04	-	-	-
Funktion im digitalen Workflow : 54. Jahrestagung der Deutschen Gesellschaft für Funktionsdiagnostik und -therapie (DGFDT) in Kooperation mit der Arbeitsgemeinschaft für Prothetik und Gnathologie der Österreichischen Gesellschaft für Zahn-, Mund- und Kieferheilkunde und mit der Arbeitsgemeinschaft Dentale Technologie (ADT)	-	Herausgeber: C.W. Haase	Quintessenz Publishing Deutschland	[Berlin]	2021	-	-	-	-	35 Seiten	28 cm	-	Journal of Craniomandibular Function. Supplement	-	-	-	Band	22,A13	610	-	-	https://d-nb.info/1247545687/04	-	-	-
CDK4/6-Inhibitor Palbociclib und PARP-Inhibitor Talazoparib im Fokus : Behandlung von HR+/HER2- metastasiertem Brustkrebs : 4 Kasuistiken aus der Praxis	-	Text Dr. rer. nat. Christin Döring	Rosenfluh Publikationen AG	Neuhausen am Rheinfall	2021	-	-	-	-	13 Seiten	30 cm	-	Topix Onkologie	Sonderbeilage der Schweizer Zeitschrift für Onkologie	-	-	Band	22,A13	610	-	-	https://d-nb.info/1247235106/04	-	-	-
Kölner Heftchen	-	Bastian Klein	Core Verlag Bastian Klein	Köln	2021	-	-	Version 2.0 Oktober 2021	-	79 Seiten	15 cm	-	-	-	-	-	Band	22,A13	610	-	-	https://d-nb.info/124711192X/04	-	-	-
Therapie des rezidivierenden/fortgeschrittenen dMMR/MSI-H Endometriumkarzinoms : Dostarlimab	-	Autorin Dr. Jennifer Kurz	Deutscher Ärzteverlag GmbH	Köln	2021	-	-	-	-	11 Seiten	28 cm	-	Lehre & Praxis ; 7. Jahrgang, Heft 4	-	-	-	Band	22,A13	610	-	-	https://d-nb.info/123663800X/04	-	-	-
Patientenrecht Zweitmeinung : einfach und verständlich erklärt	-	Volker Nürnberg, Marie-Theres Meier	Springer Fachmedien Wiesbaden GmbH	Wiesbaden	2021	-	9783658144258; 3658144254	-	(Broschur : circa EUR 14.99 (DE), circa EUR 15.41 (AT), circa CHF 17.00 (freier Preis))	XII, 129 Seiten	21 cm, 198 g	-	Sachbuch	-	Erscheint auch als: Online-Ausgabe	-	Band	22,A13; 19,N01	340; 610; 360	Ärztliche Zweitmeinung; Anspruch	344.43041	https://d-nb.info/1173819770/04	http://deposit.dnb.de/cgi-bin/dokserv?id=3559ea1ce56345e491b015151dcfc634&prov=M&dok_var=1&dok_ext=htm	-	-
Naturheilkunde in der Gynäkologie : Handbuch für Frauen	Mamamélis	Rina Nissim ; aus dem Franzözösischen von Beate Thill	Christel Göttert Verlag	Rüsselsheim	2021	-	9783939623816; 3939623814	1. Ausgabe, überarbeitet und erweitert	(Broschur : EUR 17.00 (DE), EUR 17.50 (AT))	263 Seiten	21 cm, 413 g	-	-	-	-	-	Band	22,A13; 22,N03	610	Frauenkrankheit; Naturheilverfahren	618.106	https://d-nb.info/1249164664/04	-	-	-
Handbuch für strukturelle Integration : Atmung, Bewegung	-	Hans Georg Brecklinghaus	Lebenshaus Verlag	Freiburg i. Br	2021	-	9783982370910; 3982370914	3., erweiterte und überarbeitete Auflage	EUR 82.00 (DE), EUR 84.30 (AT)	402 Seiten	23 cm	-	-	-	-	-	Band	22,A13; 21,N50	610	Rolfing; Atmung	615.82	https://d-nb.info/124729398X/04	-	-	-
Clinical oncology : viva voce, OSCEs, and ESMO exam compendium	-	Venkata Pradeep Babu Koyyala, MD, DNB, ECMO; Sajjan Rajpurohit, MD, DNB, ECMO	Thieme	Delhi; Stuttgart; New York; Rio de Janeiro	2021	-	9788194558644; 8194558646	-	(Broschur : EUR 39.99 (DE) (freier Preis), EUR 41.20 (AT) (freier Preis))	xvii, 405 Seiten	22 cm, 678 g	-	-	-	-	-	Band	22,A13; 21,N49	610	Krebs	616.994	https://d-nb.info/1246767619/04	http://deposit.dnb.de/cgi-bin/dokserv?id=c3310f87e47c44dfada448d32afffd8d&prov=M&dok_var=1&dok_ext=htm	-	-
Die antitumorale Speisekarte : was Krebszellen nicht mögen	-	Henning Schramm	anthrosana	Arlesheim	2021	-	9783905364439; 3905364433	-	(Broschur : EUR 10.00 (DE) (freier Preis), EUR 10.30 (AT) (freier Preis), CHF 10.00 (freier Preis))	53 Seiten	21 cm	-	Anthrosana ; Heft Nummer 243	-	-	-	Band	22,A13; 21,N47	610	-	-	https://d-nb.info/1246096439/04	-	-	-
Update Hämatologie/Onkologie 2021	-	Bandherausgeber Stephan Petrasch, Wesel; Gerhard Ehninger, Dresden	LUKON Verlagsgesellschaft mbH	München	2021	-	9783933012739; 3933012732	-	(Broschur : EUR 49.50 (DE), EUR 50.90 (AT))	VII, 688 Seiten	21 cm	-	Colloquium Onkologie ; Band 29	-	-	-	Band	22,A13; 21,N44	610	Krebs	616.994	https://d-nb.info/1244452130/04	-	-	-
Die schlimmste und die beste Zeit meines Lebens	-	Dr. Bodo Schiffmann	Kamasha-Verlag	Fulda	2021	-	-	-	-	Bände	21 cm	-	-	-	-	-	Band	22,A13	610; 360; 320	-	-	-	-	-	-
Die schlimmste und die beste Zeit meines Lebens : Vom Schwindelarzt zum Verschwörungs-Sachverständigen	-	Dr. Bodo Schiffmann	Kamasha Verlag	Fulda	2021	-	9783936767612; 9783936767599; 3936767610	2., überarbeitete Auflage	(Festeinband : EUR 28.99 (DE), EUR 29.80 (AT));  : (Broschur)	216 Seiten	22 cm	-	-	-	Erscheint auch als: Druck-Ausgabe	-	Band	22,A13; 21,N40	610; 360; 320	-	-	https://d-nb.info/1242194061/04	-	-	-
Entwicklungspsychologische Grundlagen der Psychoanalyse	-	Hermann Staats	W. Kohlhammer Verlag	Stuttgart	2021	-	-	1. Auflage	-	Bände	21 cm	-	Psychoanalyse im 21. Jahrhundert	-	-	-	Band	22,A13	150; 610	Psychoanalyse; Entwicklungspsychologie	150.195	-	-	-	-
Außergewöhnliche Facetten der Sexualität : psychologische, gesellschaftliche und kulturelle Phänomene	-	Thomas Haenel	Frank & Timme, Verlag für wissenschaftliche Literatur	Berlin	2021	-	9783732907861; 3732907864	-	(Broschur : EUR 24.80 (DE), EUR 24.80 (AT), CHF 37.20 (freier Preis))	157 Seiten	21 cm	-	-	-	Erscheint auch als: Online-Ausgabe	-	Band	22,A13; 21,N38	610; 150; 300	Psychosexuelle Störung; Sexualverhalten	616.8583	https://d-nb.info/1241129495/04	-	-	-
Operationen & konservative Therapie an Fuß und Sprunggelenk : ein Praxisscript	-	Dr. Hartmut Stinus	Cuvillier Verlag	Göttingen	2021	-	9783736974524; 3736974523	1. Auflage	(Broschur : EUR 59.90 (DE), EUR 61.60 (AT))	159 Seiten	24 cm	-	-	-	-	-	Band	22,A13; 21,N37	610	Fußkrankheit; Therapie; Sprunggelenkverletzung; Orthopädische Chirurgie	617.585	https://d-nb.info/1240916086/04	-	-	-
Ein Beitrag zur Entwicklung einer additiv gefertigten Unterschenkelorthese unter Berücksichtigung biomechanischer Aspekte des Charcot-Fußes	-	Tommy Schafran	Shaker Verlag	Düren	2021	-	9783844082036; 3844082034	-	(Broschur : EUR 45.80 (DE), EUR 45.80 (AT), CHF 57.30 (freier Preis))	VIII, 131 Seiten	21 cm, 224 g	-	Berichte aus der Medizintechnik	-	Erscheint auch als: Online-Ausgabe	Dissertation; Universität Paderborn2021	Band	22,A13; 21,N33	610; 670	Fuß; Funktionelle Anatomie; Biomechanik; Charcot-Marie-Syndrom; Unterschenkel; Orthese; Prototyp; Rapid Prototyping	617.584; 681.761; 617.5	https://d-nb.info/1238981585/04	-	-	-
Ein Geisteskranker als Künstler - Adolf Wölfli	-	von Priv.-Doz. Dr. W. Morgenthaler (Chefarzt der priv. Heil- und Pflegeanstalt Münchenbuchsee bei Bern) ; Herausgeber Hilar Stadler und Adolf Wölfi-Stiftung, Kunstmuseum Bern	Verlag der Buchhandlung Walther und Franz König	Köln	2021	-	9783753300610; 3753300616	-	(Broschur : EUR 28.00 (DE), EUR 28.80 (AT))	279 Seiten	23 cm	-	-	-	-	-	Band	22,A13; 21,N29	700; 610	Wölfli, Adolf; Kunst; Schizophrenie; Psychopathologie	700.92	https://d-nb.info/1237063078/04	-	-	-
The loss of male sexual desire in ancient Mesopotamia : Nīš Libbi therapies	Nīš Libbi therapies	Gioele Zisa ; with a foreword by Alessandro Lupo	De Gruyter	Berlin	2021	-	9783110757040; 3110757044	-	(Festeinband : EUR 119.95 (DE) (freier Preis), EUR 119.95 (AT) (freier Preis))	XXIV, 588 Seiten	25 cm, 1121 g	-	Medical traditions ; volume 5	-	Erscheint auch als: Online-Ausgabe	Dissertation; Ludwig-Maximilians-Universität München2018	Band	22,A13; 21,N27	610	Mann; Sexualstörung	614.5969	https://d-nb.info/1236306511/04	-	-	-
Gerontologie und Gerontopsychiatrie : für Pflegeberufe	-	Ulrike Marwedel	Verlag Europa-Lehrmittel Nourney, Vollmer GmbH & Co. KG	Haan-Gruiten	2021	-	9783808565087; 380856508X	8. aktualisierte Auflage	(Broschur : EUR 26.90 (DE))	394 Seiten	24 cm, 358 g	-	Europa-Fachbuchreihe für Berufe im Gesundheitswesen	-	-	-	Band	22,A13; 21,N24	S; 610; 360	-	-	https://d-nb.info/1235282325/04	-	-	-
Das Labyrinth der Borderline-Kommunikation : klinische Zugänge zum Erleben von Raum und Zeit	-	Heinz Weiss ; mit einem Vorwort von John Steiner	Klett-Cotta	Stuttgart	2021	-	9783608980813; 3608980814	Zweite Auflage	(Broschur : EUR 30.00 (DE), EUR 30.90 (AT))	220 Seiten	23 cm, 336 g	-	Fachbuch	-	Erscheint auch als: Druck-Ausgabe; Erscheint auch als: Online-Ausgabe	-	Band	22,A13; 21,N24	610; 150	Borderline-Persönlichkeitsstörung; Psychotherapie	616.858520651	https://d-nb.info/1235240576/04	-	-	-
Der stumme Schrei : wenn der Krieg zu Ende ist, ist noch lange kein Frieden	-	Helga Zwosta	Europa Verlagsgruppe	Berlin	2021	-	9791220108225	Erstausgabe	(Broschur : EUR 14.90 (DE))	198 Seiten	21 cm	-	Universum	-	-	-	Band	22,A13; 21,N20	610; 150; 943	Familie; Generationsbeziehung; Psychisches Trauma; Weitergabe	616.8521	https://d-nb.info/1233433512/04	-	-	-
In Beziehung sein : Palliative Care und christliche Verantwortung : 20 Porträts aus der Schweiz	-	Martina Holder-Franz, Maria Zinsstag	TVZ Theologischer Verlag Zürich	Zürich	2021	-	9783290184285; 3290184285	-	(Broschur : circa EUR 26.90 (DE), circa EUR 27.70 (AT), circa CHF 29.80 (freier Preis))	194 Seiten	20 cm	-	-	-	-	-	Band	22,A13; 21,N19	230; 360; 610	Hospizbewegung; Palliativpflege; Spiritual Care	261.83217560922494; 362.17560922494	https://d-nb.info/1232834831/04	-	-	-
Heilpflanzliche Inhaltsstoffe und naturheilkundliche Methoden im naturwissenschaftlichen Sachunterricht : Entwicklung, Erprobung und Evaluierung von handlungsorientierten Experimenten im Sachunterricht der Jahrgangsstufe 4	-	Marina Brusdeilins	Verlag Dr. Kovač	Hamburg	2021	-	9783339123169; 3339123160	-	(Broschur : EUR 99.80 (DE), EUR 102.60 (AT))	XV, 323 Seiten	21 cm, 445 g	-	Schriftenreihe Didaktik in Forschung und Praxis ; Band 110	-	-	Dissertation; Universität Bielefeld2020	Band	22,A13; 21,N17	370; 610	Heilpflanzen; Naturheilkunde; Sachunterricht; Schuljahr 4	372.357	https://d-nb.info/1232150959/04	https://www.verlagdrkovac.de/978-3-339-12316-9.htm	-	-
Der Zauber der Entspannung : Im "bewusste(re)n Sein" leben oder Sieh genau hin	-	Lisa M. Felis ; mit einem Vorwort von Karl Wallot	Ebozon Verlag	[Traunreut]	2021	-	9783959637909; 395963790X	Printausgabe 1. Auflage	(Broschur : EUR 14.99 (DE), EUR 15.50 (AT))	96 Seiten	19 cm	-	-	-	Erscheint auch als: Online-Ausgabe	-	Band	22,A13; 21,N17	150; 610	-	-	https://d-nb.info/1232017779/04	-	-	-
Beckenboden-Yoga entspannt : Erdung, Kraft und erfüllte Sexualität	-	Sarah Lucke	Windpferd	Oberstdorf	2021	-	9783864103254; 3864103258	3., erweiterte Auflage	(Festeinband : circa EUR 16.95 (DE), circa EUR 17.50 (AT))	144 Seiten	16 cm, 258 g	-	-	-	-	-	Band	22,A13; 21,N17	610	Yoga; Beckenboden	613.7046	https://d-nb.info/1231932872/04	http://deposit.dnb.de/cgi-bin/dokserv?id=0cc9be045a534f0d88bb1df85853be54&prov=M&dok_var=1&dok_ext=htm	-	-
Transgenerationale Therapie : 75 Therapiekarten	-	Lück	Beltz	Weinheim; Basel	2021	-	-	-	-	75 Blätter, das heißt 150 Seiten	Behältnis 18 x 25 x 5 cm, 1275 g	1 Booklet (27 Seiten)	-	-	-	-	Karte	22,A13; 21,N16	610; 150	Psychisches Trauma; Nachkomme; Psychosoziale Belastung; Generationsbeziehung	616.852106510854	https://d-nb.info/1231247460/04	http://deposit.dnb.de/cgi-bin/dokserv?id=8d9bf370e12c4608b58469777104ca02&prov=M&dok_var=1&dok_ext=htm	-	-
Der Jungbrunnen-Effekt: wie 16 Stunden Fasten Ihr Leben verändert	-	P.A. Straubinger, Margit Fensl, Nathalie Karré	Knaur.Leben	München	2021	-	9783426879191; 3426879190	Vollständige Taschenbuchausgabe	(Broschur : EUR 12.00 (DE), EUR 12.40 (AT))	187 Seiten	19 cm, 195 g	-	-	-	-	-	Band	22,A13; 21,N15	610; 150	Intermittierendes Fasten	613.25	https://d-nb.info/1230920331/04	http://deposit.dnb.de/cgi-bin/dokserv?id=04258b0df1754eddb0490295070b27b7&prov=M&dok_var=1&dok_ext=htm	-	-
Motivation stärken in Therapie und Beratung : ein Praxisbuch	-	Almut Lippert	Springer	Berlin, Germany	2021	-	9783662633021; 3662633027	-	(Broschur : circa EUR 34.99 (DE), circa EUR 35.97 (AT), circa CHF 39.00 (freier Preis), circa EUR 32.70)	XV, 205 Seiten	24 cm, 473 g	-	Psychotherapie: Praxis	-	Erscheint auch als: Online-Ausgabe	-	Band	22,A13; 21,N14	610; 150	Psychotherapie; Beratung; Klient; Motivation	616.8914	https://d-nb.info/1230697357/04	http://deposit.dnb.de/cgi-bin/dokserv?id=d2813b942f0843e49f69289342c5227b&prov=M&dok_var=1&dok_ext=htm	-	-
Unser Körper - Ausdruck, Haltung, Körpersprache : mit der TCM neu wahrnehmen	-	Mike Mandl	Springer	Berlin, Germany	2021	-	9783662633816; 3662633817	-	(Broschur : circa EUR 19.99 (DE), circa EUR 20.55 (AT), circa CHF 22.50 (freier Preis), circa EUR 18.68)	XI, 168 Seiten	24 cm, 347 g	-	Sachbuch	-	Erscheint auch als: Online-Ausgabe	-	Band	22,A13; 21,N14	610	-	-	https://d-nb.info/1230697055/04	http://deposit.dnb.de/cgi-bin/dokserv?id=b3dbdc43f6384d448b6362190c674fa3&prov=M&dok_var=1&dok_ext=htm	-	-
Biomimetics : a molecular perspective	-	Raz Jelinek	De Gruyter	Berlin	2021	-	9783110709445; 3110709449	2nd edition	(Broschur : EUR 79.95 (DE) (freier Preis), EUR 79.95 (AT) (freier Preis))	VI, 272 Seiten	24 cm, 466 g	-	De Gruyter graduate	-	Erscheint auch als: Online-Ausgabe	-	Band	22,A13; 21,N14	570; 610; 660	Biomimetikum	570.284; 610.284	https://d-nb.info/1230633898/04	-	-	-
Rückentraining mit Theraband und Pezziball - Übungen für einen gesunden Rücken/ Andrea Röwekamp	-	-	Copress	Grünwald	2021	-	9783767912786; 3767912783	7. Auflage	(Broschur : EUR 16.90 (DE), EUR 17.40 (AT))	124 Seiten	25 cm	-	-	-	-	-	Band	22,A13; 21,N14	610	Wirbelsäulengymnastik; Gummiband; Pezziball; Rückenschule	616.730620284	https://d-nb.info/1230427562/04	http://deposit.dnb.de/cgi-bin/dokserv?id=37d50cc526404b4696c7764a06a408e7&prov=M&dok_var=1&dok_ext=htm	-	-
Wie wir denken, wie wir fühlen : die Ursprünge unseres Bewusstseins	Feeling and knowing	Antonio Damasio ; aus dem Englischen von Sebastian Vogel	Carl Hanser Verlag	München	2021	-	9783446270947; 3446270949	1. Auflage	(Festeinband : circa EUR 22.00 (DE), circa EUR 22.70 (AT))	191 Seiten	21 cm, 299 g	-	-	-	Erscheint auch als: Online-Ausgabe	-	Band	22,A13; 21,N13	150; 610; 100	Bewusstsein; Verstand; Gefühl; Evolutionsbiologie; Neurobiologie; Neurophilosophie; Psychologie	153; 152.4	https://d-nb.info/1230156925/04	-	-	-
Pflegebedürftigkeit unterscheiden : explorative statistische Verfahren zur Entwicklung einer Typologie	-	Johannes Michael Bergmann	Nomos	Baden-Baden	2021	-	9783848777549; 3848777541	1. Auflage	(Broschur : circa EUR 39.00 (DE))	259 Seiten	23 cm, 376 g	-	Statistik in Sozialer Arbeit, Pflege und den Humanwissenschaften ; Band 1	-	-	Dissertation; Philosophisch-Theologische Hochschule Vallendar2020	Band	22,A13; 21,N08	360; 610	Pflegeversicherung; Pflegebedürftigkeit; Medizinisches Gutachten; Pflegegrad; Handlungstest; Motorik	368.382	https://d-nb.info/1227349270/04	http://deposit.dnb.de/cgi-bin/dokserv?id=498f20c4b0244505b653400375c2e120&prov=M&dok_var=1&dok_ext=htm	-	-
